tag,content
0,"הוארך לפי הוראות סעיף קטן (א) רישיון לישיבת ביקור שניתן לעובד זר לשם העסקתו במתן טיפול סיעודי, לתקופה כוללת של חמש שנים (בסעיף קטן זה – תקופת ההארכה הכוללת), רשאי שר הפנים להאריך את הרישיון לשם המשך העסקתו של העובד הזר במתן טיפול סיעודי לאותו מטופל, לתקופות נוספות שלא יעלו על שנה כל אחת, בהתקיים התנאים המפורטים להלן:"
0,"העובד הזר הועסק במתן טיפול סיעודי לאותו מטופל, ברציפות, במשך השנה שבתכוף לפני תום תקופת ההארכה הכוללת;"
0,"על אף האמור בסעיפים קטנים (א) ו-(ב), שר הפנים רשאי להאריך רישיון לישיבת ביקור לשם העסקה של עובד זר שחלפו 63 חודשים מיום כניסתו לישראל לראשונה באשרת עובד זמני בענף הסיעוד, לשם העסקתו במתן טיפול סיעודי למטופל בעל היתר להעסקת עובד זר לפי סעיף 1יג לחוק עובדים זרים (להלן – מטופל סיעודי), מטעמים הומניטריים מיוחדים וחריגים המתקיימים במטופל הסיעודי והקשורים למורכבות או לייחודיות הטיפול הסיעודי הנדרש לו או לנסיבות אישיות אחרות של המטופל, ובלבד שבמועד הגשת הבקשה לא חלפו למעלה מ-90 ימים מיום סיום תקופת העסקתו החוקית האחרונה בישראל של העובד הזר שמבקשים להאריך את רישיונו והתקיימו לגביו תנאים אלה:"
0,"בתקופת שהותו בישראל הועסק העובד הזר כדין אצל מטופל סיעודי מסוים 24 חודשים רצופים לפחות; לעניין זה, יראו מעבר בין מטופלים בעקבות פטירת מטופל או מעבר המטופל למוסד סיעודי כאילו המשיך העובד הזר לטפל באותו מטופל ברציפות;"
0,"העובד הזר סיים את תקופת העסקתו האחרונה בישראל לפני מועד הגשת הבקשה לפי סעיף זה, בעקבות פטירת המטופל הסיעודי שבו טיפל או בעקבות מעבר קבוע של המטופל הסיעודי למוסד סיעודי;"
0,"בעת הגשת הבקשה לפי סעיף זה, לא עברו 8 שנים מיום כניסתו לישראל לראשונה של העובד הזר לעבודה בענף הסיעוד;"
0,"לא התקבלה החלטה קודמת של שר הפנים להארכת רישיונו של העובד הזר לפי סעיף קטן זה, למעט החלטה להאריך רישיון לישיבת ביקור לשם טיפול בבן זוג של המטופל הסיעודי שהתגורר יחד עם המטופל הסיעודי בעת העסקת העובד הזר;"
0,הוועדה שמונתה לפי הוראות פסקה (2) המליצה לשר הפנים על הארכת הרישיון של העובד הזר; המליצה הוועדה שלא להאריך את הרישיון – תידחה הבקשה והעובד הזר ייצא מישראל בתוך 30 ימים ממועד ההודעה על דחיית בקשתו כאמור;
0,"לא ייכנס אדם לישראל ולא ייצא ממנה, בין שהוא אזרח ישראלי ובין שאיננו אזרח ישראלי, אלא באחת מתחנות הגבול שקבע שר הפנים בצו שפורסם ברשומות, ולאחר שהתייצב שם לפני קצין בקורת הגבולות או בקר גבולות והציג לפניו דרכון, תעודת מעבר או תעודה אחרת שהוציא למטרה זו שר הפנים, בני-תוקף; שר הפנים רשאי לפטור אדם מהוראות סעיף זה, אם יש נסיבות מיוחדות המצדיקות זאת לדעתו."
0,"על אף האמור בכל דין, לא יצא אדם מישראל לאחת הארצות המפורטות בסעיף 2א לחוק למניעת הסתננות (עבירות ושיפוט), התשי""ד-1954, ולא ייכנס אזרח ישראלי או תושב ישראל, בכל דרך שהיא, לאחת מארצות אלה, אלא בהיתר מאת שר הפנים או ראש הממשלה (להלן – נותן ההיתר); בסעיף קטן זה, ""תושב"" – מי שמחזיק אשרה ורישיון בני-תוקף, לפי סעיף 2(א)(3) או (4)."
0,"היתר כאמור בסעיף קטן (א) יכול שיהיה כללי או אישי, ורשאי נותן ההיתר לקבוע בו תנאים, סייגים או הגבלות."
0,"תחילתו של היתר כללי לפי סעיף זה או תנאי, סייג או הגבלה שבו (בסעיף קטן זה – ההיתר), תהיה עם פרסומו ברשומות; גובשה עילה לקביעת ההיתר בנסיבות המחייבות החלה מיידית שלו ולא היה ניתן לפרסמו ברשומות באופן מיידי, הוא יפורסם בדרך אחרת שנראית לנותן ההיתר מתאימה בנסיבות העניין ושתביא אותו לידיעת הציבור, ובלבד שיפורסם ברשומות מיד כשיהיה ניתן לעשות כן; פורסם היתר בדרך מתאימה אחרת כאמור, תהיה תחילתו במועד הפרסום כאמור, ובלבד שהנוסח שפורסם ברשומות יהיה הנוסח המחייב."
0,"רב החובל של אניה והאחראי על אוירון, על רכבת, על מכונית או על כלי-הסעה אחר שבאו לישראל או שעומדים לצאת ממנה, חייבים למסור לקצין בקורת הגבולות או לבקר גבולות, לפי דרישתו, את רשימת האנשים הנמצאים באותו כלי-הסעה, לרבות העובדים בו; הרשימה תפרט את הפרטים שקבע שר הפנים בתקנות לפי חוק זה."
0,"קצין בקורת הגבולות רשאי להיכנס לכל כלי הסעה שבא לישראל או שעומד לצאת ממנה, ולערוך בו בקורת; וכל אדם הנמצא בו, לרבות כל עובד בו, חייבים להראות לקצין בקורת הגבולות, לפי דרישתו, את המסמכים ולתת לו את הידיעות הנוגעות לביצועו של חוק זה."
0,"מי שבא לישראל ורוצה להיכנס אליה, רשאי קצין בקורת הגבולות לעכב את כניסתו עד לבירור אם רשאי הוא להיכנס, ולהורות מקום ששם יימצא עד גמר הבירור או עד ליציאתו מישראל."
0,"מי שבא לישראל ונמצא שאינו רשאי להיכנס אליה, רשאי שר הפנים להרחיקו מישראל."
0,קצין בקורת הגבולות רשאי להחזיק אדם כזה במקום ובאופן שקבע שר הפנים עד ליציאתו מישראל או עד להרחקתו ממנה.
0,"רב החובל של אניה והאחראי על אוירון, על רכבת, על מכונית או על כלי-הסעה אחר שבאו לישראל, חייבים, לפי דרישת קצין בקורת הגבולות, להסיע מישראל כל אדם שבא באותו כלי-הסעה על מנת להיכנס לישראל ונמצא שאינו רשאי לכך."
0,"לא יינתן רשיון ולא תינתן אשרה לעובד זר לפי סעיף 2, אלא אם כן הומצא אישור רפואי כמשמעותו בסעיף 1ב לחוק עובדים זרים, ושולמו האגרות לפי סעיף 1י לחוק האמור."
0,"שר הפנים רשאי לפטור עובד זר מהמצאת אישור רפואי; פטור לפי סעיף זה יכול שיהיה אישי או לסוגי עובדים זרים, ובלבד שפטור לגבי סוגי עובדים זרים יינתן בהתייעצות עם שר הבריאות ועם שר התעשייה המסחר והתעסוקה."
0,"  מצא שר הפנים כי עובד זר, כהגדרתו בפרק ד'1 לחוק עובדים זרים, שניתנו לו אשרה ורישיון לישיבת ביקור לפי חוק זה, לא הועסק בתחום העיסוק שנקבע ברישיונו לפי סעיף 2(ג), למשך תקופה העולה על 90 ימים, בלא שנמצאו לכך טעמים מיוחדים אשר לא אפשרו לאותו עובד זר או לסוג עובדים זרים למצוא עבודה בתחום העיסוק בתקופה האמורה, יבטל שר הפנים את האשרה ואת רישיון הישיבה שניתנו לעובד הזר, ובלבד שנתן לו הזדמנות להשמיע את טענותיו; שר הפנים רשאי לאשר לעובד זר או לסוג עובדים זרים לחרוג מהתקופה שנקבעה כאמור אם מצא כי הדבר מוצדק בנסיבות העניין."
0,"שר הפנים רשאי בהחלטה מנומקת לבטל אשרת עולה ותעודת עולה שניתנו לפי חוק השבות, תש""י-1950, אם הושגו על ידי מתן ידיעות כוזבות."
0,"לא ימלא אדם תפקיד שקבע השר, באישור הוועדה, בקשר להפעלה של כלי טיס, לביצוע פעולות בדק בכלי טיס או למתן שירותי נת""א, לרבות מדריך לתפקיד כאמור, אלא אם כן בידו רישיון לכך שניתן לפי הוראות סימן זה ובהתאם להגדר שברישיון, לתנאי הרישיון ולהוראות לפי חוק זה."
0,"המנהל ייתן רישיון עובד טיס או הגדר למבקש שמתקיימים בו התנאים שקבע השר לפי סעיף קטן (ב), וכן התנאים המפורטים להלן, לפי העניין:"
0,לעניין תפקיד שסווג בסיווג ביטחוני לפי סעיף 5 – נקבעה למבקש התאמה ביטחונית לתפקיד האמור לפי הוראות אותו סעיף;
0,לעניין רישיון או הגדר מסוג שקבע השר לפי סעיף 6(א) – בידי המבקש תעודה רפואית מתאימה ותקפה כאמור באותו סעיף.
0,"השר, באישור הוועדה, רשאי לקבוע תנאים למתן רישיון עובד טיס או הגדר, ובכלל זה הוראות בעניינים אלה:"
0,דרישת גיל מזערי או גיל מרבי;
0,"הכשרה, מיומנות, ידע וניסיון מקצועי הנדרשים לצורך קבלת הרישיון או ההגדר והדרכים לבדיקתם, ובכלל זה בחינות שעל המבקש לעמוד בהן;"
0,תנאים המביאים בחשבון את עברו הפלילי של המבקש.
0,"על אף הוראות סעיף 2, אדם רשאי למלא תפקיד כאמור באותו סעיף, אף בלא רישיון עובד טיס, אם בידו רישיון לכך שניתן לו מאת הרשות המוסמכת לעניין זה במדינה חברה, שאישר המנהל לפי סעיף זה, ובהתאם להגדר שברישיון, לתנאי הרישיון והאישור ולהוראות לפי חוק זה."
0,המנהל ייתן אישור לפי סעיף קטן (א) למבקש שמתקיימים לגביו התנאים שקבע השר למתן אישור כאמור; בתקנות לפי סעיף קטן זה רשאי השר לקבוע את ההליכים לקבלת האישור.
0,"אישור שניתן לפי סעיף זה ובעל אישור כאמור, יראו אותם לעניין דיני הטיס כרישיון עובד טיס וכעובד טיס, בהתאמה."
0,"הרואה את עצמו נפגע מהחלטת המנהל לפי סעיף זה, רשאי לערור עליה לפני ועדת הערר, ויחולו הוראות סעיף 39, בשינויים המחויבים."
0," השר, באישור הוועדה, רשאי לקבוע סוגי עובדי טיס ואנשי צוות שלגביהם ימלא שירות הביטחון הכללי את תפקידו לפי סעיף 7(ב)(3) לחוק שירות הביטחון הכללי, התשס""ב-2002, לעניין קביעת הוראות בדבר סיווג ביטחוני וקביעת התאמה ביטחונית; על קביעת הוראות בדבר סיווג ביטחוני וקביעת התאמה ביטחונית, יחולו הוראות החוק האמור, בשינויים המחויבים."
0,"לא ימלא עובד טיס שבידו רישיון עובד טיס או הגדר, מסוג שקבע השר באישור הוועדה, את תפקידו בהתאם לרישיון או להגדר –"
0,"אלא אם כן בידו תעודה רפואית תקפה המאשרת את התאמתו הבריאותית למלא את תפקידו בהתאם לרישיון או להגדר, שניתנה לו לפי הוראות סעיף זה בידי רופא הרשות או בידי רופא בעל הכשרה ברפואה תעופתית שהוסמך לעניין סעיף זה בידי המנהל, בהמלצת רופא הרשות (בסעיף זה ובסעיף 7 – רופא מוסמך), והוא פועל בהתאם לתנאי התעודה האמורה;"
0,"אם חל, ממועד מתן התעודה הרפואית, שינוי במצב בריאותו העלול לפגוע ביכולתו למלא את תפקידו בהתאם לרישיון או להגדר, ועובד הטיס יודע כי השינוי עלול לפגוע ביכולתו כאמור."
0,"השר, בהתייעצות עם שר הבריאות, רשאי לקבוע הוראות בעניינים אלה:"
0,"התנאים וההליכים למתן תעודה רפואית ולקביעת התאמתו הבריאותית של אדם למלא תפקיד של עובד טיס, לפי סעיף זה, ובכלל זה הבדיקות הרפואיות הנדרשות לשם כך, לרבות בדיקות תקופתיות ובדיקות ביקורת, ובלבד שבדיקות כאמור יבוצעו בידי רופא הרשות או רופא מוסמך;"
0,סוגי תעודות רפואיות שיינתנו בידי רופא הרשות או רופא מוסמך;
0,תקופת תוקפה של תעודה רפואית ותנאים לפקיעת תוקפה;
0,"הגבלות ותנאים לשימוש בסמי מרפא כהגדרתם בפקודת הרוקחים [נוסח חדש], התשמ""א-1981, בידי עובדי טיס."
0,"הוראות שקבע השר לפי סעיף קטן (ב), לעניין התנאים למתן תעודה רפואית ולעניין תנאים לפקיעת תוקפה, טעונות אישור של הוועדה."
0,"רופא המטפל בעובד טיס שבידו רישיון עובד טיס או הגדר מסוג שקבע השר לפי סעיף קטן (א), היודע כי המטופל הוא עובד טיס כאמור, וסבור כי אותו עובד טיס, בהשתמשו ברישיונו, עלול לסכן את עצמו או את זולתו מחמת מצבו הרפואי, ידווח על כך לרופא הרשות או לרופא מוסמך, ויידע את עובד הטיס על אודות הדיווח כאמור."
0,"היה לעובד טיס ספק לעניין התאמתו הבריאותית למילוי תפקידו, בין השאר בעקבות בדיקת רופא כאמור בסעיף קטן (ד), יפנה לרופא מוסמך לשם בירור הספק."
0,"רופא הרשות, רופא מוסמך או ועדת הערר הרפואית רשאים לדרוש מכל אדם, לרבות ממטפל וממוסד רפואי כהגדרתם בחוק זכויות החולה, התשנ""ו-1996, למסור להם מידע או מסמך, המצוי בידם, לגבי מצבו בריאותו של מי שנבחנת התאמתו הבריאותית למלא תפקיד של עובד טיס, שיש בו כדי להשפיע על ההכרעה בדבר התאמה בריאותית כאמור; המבקש תעודה רפואית או את חידושה יחתום על כתב ויתור על סודיות רפואית, לגבי מידע או מסמך כאמור;"
0,"דרשו רופא הרשות, רופא מוסמך או ועדת הערר הרפואית מידע או מסמך לפי פסקה (1), ימסור להם מי שנדרש כאמור את המידע או המסמך, בתוך התקופה שנקבעה בדרישה;"
0,"רופא הרשות, רופא מוסמך או ועדת הערר הרפואית לא ימסרו מידע או מסמך שהגיע לידיהם לפי הוראות סעיף קטן זה, אלא למי שהוסמך לכך על פי דין או על פי צו של בית משפט;"
0,הוראות סעיף קטן זה יחולו גם על המדינה.
0,הרואה את עצמו נפגע מהחלטת רופא מוסמך רשאי להשיג עליה לפני רופא הרשות.
0,הרואה את עצמו נפגע מהחלטת רופא הרשות רשאי לערור עליה לפני ועדת הערר הרפואית.
0,"השר ימנה רופא בעל הכשרה וניסיון ברפואה תעופתית ליושב ראש ועדת הערר הרפואית, ורופא מוסמך שמתמלאים בו התנאים האמורים לממלא מקומו, ויכין רשימה של רופאים בעלי הכשרה וניסיון ברפואה תעופתית ורופאים שהם עובדי טיס בעלי רישיון או הגדר מסוג שנקבעה לגביו חובת התאמה בריאותית לפי סעיף 6(א), הכשירים לשמש במותבים של ועדת הערר הרפואית;"
0,השר יקבע הוראות לעניין תנאי הכשירות של חברי ועדת הערר הרפואית ולעניין סדרי הדין בוועדת הערר.
0,"ועדת הערר הרפואית תדון בערר לפי סעיף קטן (ב) במותב של שלושה, והם: יושב ראש ועדת הערר הרפואית או ממלא מקומו, והוא יהיה יושב ראש המותב, ושני חברים שימנה יושב ראש המותב, בעלי מומחיות מתאימה לנושא הנדון בערר, מתוך רשימה כאמור בסעיף קטן (ג)(1);"
0,"ועדת ערר רפואית רשאית לאשר את החלטת רופא הרשות, לבטלה או לשנותה, וכן להורות על עריכת בדיקה נוספת, ככל שתמצא לנכון."
0,"החלטת ועדת הערר הרפואית ניתנת לערעור לפני בית משפט לעניינים מינהליים, בשאלה משפטית בלבד."
0,"עובד טיס ואיש צוות לא ישתו משקה משכר בעת מילוי תפקידם ולא ימלאו את תפקידם כשהם נתונים תחת השפעת אלכוהול, או לאחר ששתו משקה משכר וטרם חלף פרק הזמן שקבע השר, או כאשר מצוי בגופם סם מסוכן או תוצר חילוף חומרים של סם מסוכן."
0,"עובד טיס שלא מתקיימות לגביו, במלואן, אמות המידה המחייבות שקבע ארגון התעופה הבין-לאומי בנספחי האמנה לפי סעיף 37 לאמנה החלות לגבי עובד טיס מאותו סוג, יפרט המנהל ברישיון עובד הטיס או בתעודה הרפואית של עובד הטיס, לפי העניין, את אי-ההתאמה לאמות המידה המחייבות כאמור."
0,"מי שברישיונו או בתעודה הרפואית שלו פורטה הערה בדבר אי-התאמה לפי סעיף קטן (א), לא ישמש כאיש צוות בעמדתו בכלי טיס ישראלי המופעל בשטחה של מדינה חברה, אלא באישור הרשויות המוסמכות של אותה מדינה."
0, לא יעסוק אדם הרוקחות אלא אם ניתן לו רשיון לפי הוראות פקודה זו.
0,"המבקש רשיון לעסוק ברוקחות יגיש בקשה בדרך שנקבעה ויביא ראיות המניחות את הדעת בדבר זהותו, אופיו הטוב, היותו מסוגל לעסוק ברוקחות ובעל הכשירויות שנקבעו."
0,לפני מתן הרשיון רשאי המנהל לדרוש שהמבקש יעמוד בבחינה נוספת על כל בחינה שעמד בה לשם קבלת הדיפלומה ברוקחות לרבות בחינת רישוי כפי שיקבע.
0,"מי שהוכיח להנחת דעתו של המנהל, כי נתקיימו בו כל התנאים המפורשים להלן, יירשם לפי בקשתו במשרד הבריאות ויקבל רשיון לעבוד כעוזר רוקח:"
0,הוא בעל אופי טוב;
0,הוא בגיר;
0,הוא אזרח ישראלי או בעל רשיון לישיבת קבע בישראל;
0,"אין בהוראות סעיף קטן (א) כדי לגרוע מסמכותה של רשות חינוך מקומית לקבוע שיעור השתתפות בתקציבי מוסדות חינוך מוכרים לא רשמיים הפועלים בתחומה, כולם או חלקם, העולה על השיעור בהסדר הקובע, והיא רשאית לעשות כן גם לגבי רכיב מהרכיבים להשתתפות בתקציב לפי סעיף זה."
0,"יוקם ועד לעניני החינוך (להלן – ועד החינוך), אשר מספר חבריו יהיה לא פחות מחמישה עשר. חברי הועד יתמנו על ידי השר, באישור הממשלה, כל אחד לתקופה של ארבע שנים. כחברי הועד יתמנו אנשים פעילים בשדה החינוך, עובדים של משרד החינוך והתרבות שמספרם לא יעלה על 25% מכל חברי הועד ומועמדים של רשויות מקומיות, מוסדות החינוך הגבוה והסתדרות המורים, מתוך רשימות שיוגשו לשר לפי בקשתו."
0,"תוקם מועצה לחינוך ממלכתי דתי; חברי המועצה יתמנו על ידי השר, באישור הממשלה, כל אחד לתקופה של ארבע שנים. שני חברים יהיו באי כוחו של השר, ששה חברים יתמנו מתוך רשימה של שנים עשר מועמדים שתוצע על ידי שר הדתות, שלושה חברים יתמנו מתוך רשימה של ששה מועמדים לפחות שתוצע, בהתאם לתקנות, על ידי ארגוני מורים המייצגים את המורים הדתיים, ושלושה חברים יתמנו מבין החברים הדתיים של ועד החינוך."
0,"קבע השר, לפי, סדרים ותנאים להשתתפות המדינה בתקציבי שעות הלימוד של מוסדות חינוך מוכרים לא רשמיים, בשיעור יחסי להשתתפות המדינה בתקציביהם של מוסדות חינוך רשמיים דומים (בסעיף זה – ההסדר הקובע), תשתתף רשות חינוך מקומית בתקציבי מוסדות חינוך מוכרים לא רשמיים הפועלים בתחומה בשיעור יחסי להשתתפותה בתקציביהם של מוסדות חינוך רשמיים דומים הפועלים בתחומה, לפי ההסדר הקובע; השתתפות רשות חינוך מקומית בתקציביהם של מוסדות חינוך מוכרים לא רשמיים כאמור, כולה או חלקה, יכול שתהיה גם בכסף או בשווה כסף, כגון באמצעות העסקת עובדים, לכלל המוסדות או לחלקם, ובלבד ששווי ההשתתפות לגבי כל מוסד יהיה שווה לסך ההשתתפות לפי ההסדר הקובע."
0,נתאמן שלוש שנים בבית מרקחת המנוהל בידי רוקח אחראי;
0,"עמד בישראל, לפני ד' בניסן תשל""ט (1 באפריל 1979), בבחינה ברוקחות שנקבעה."
0,בעל תעודת עוזר רוקח מחוץ לארץ שהכיר בה המנהל פטור מן התנאים שבפסקאות (4) ו-(5) לסעיף קטן (א).
0,המנהל רשאי להתנות מתן רשיון לעוזר רוקח מחוץ לארץ בנסיון מעשי בבית מרקחת בארץ במשך תקופה שיקבע שלא תעלה על שנה אחת.
0,"לא יינתן רשיון לעוזר רוקח אלא למי שלפני ד' בניסן תשל""ט (1 באפריל 1979) עמד בבחינה האמורה בסעיף קטן (א)(5) או שהוא בעל תעודת עוזר רוקח מחוץ לארץ שהמנהל הכיר בה."
0,"שר הבריאות, לאחר התייעצות עם הוועדה המייעצת שמונתה לפי סעיף 5ב ובאישור ועדת העבודה הרווחה והבריאות של הכנסת, יקבע תנאים למתן רישיון למבקש שהוא בעל תואר אקדמי ברוקחות ממדינת חוץ שהוכר לפי חוק זה, שהתקיימו בו כל אלה:"
0,הוא בעל רישיון או תעודה הנדרשים לעיסוק ברוקחות במדינת חוץ;
0,"הוא עמד בבחינה שעניינה דיני רוקחות, כפי שקבע המנהל;"
0,"הוא עסק כדין וברמה מקצועית הולמת ברוקחות לאחר קבלת הרישיון או התעודה, במשך שלוש שנים לפחות, במהלך ארבע השנים שקדמו למועד הגשת הבקשה;"
