tag,content
1,המופקד על שמירת חותם שהוטבע על פי הוראה של רשות רשמית או של בית משפט או בית דין והוא בהתרשלות מניח לחותם שישובר או יסולק או ייעשה ללא מועיל דינו – מאסר ששה חדשים.
1,העובר על הוראה מהוראות סימן זה דינו – מאסר שנה אחת.
1,התוקף שוטר והתקיפה קשורה למילוי תפקידו כחוק או אדם אחר העוזר לשוטר כשהשוטר ממלא תפקידו כחוק דינו – מאסר עד שלוש שנים ולא פחות מחודש ימים.
1,התכוון להכשיל את השוטר בתפקידו או למנוע או להפריע אותו מלמלאו;
1,היה מזויין בנשק חם או קר;
1,התקיפה היתה בצוותא של יותר משני אנשים.
1,העושה מעשה בכוונה להפריע לשוטר כשהוא ממלא תפקידו כחוק או להכשילו בכך או להפריע לאדם אחר או להכשילו מלעזור לשוטר דינו – מאסר עד שלוש שנים ולא פחות משבועיים ימים.
1,משתמש או מורה להשתמש בכוח או באלימות נגד אדם כדי לסחוט ממנו או מאחר שהאדם יש לו ענין בו הודיה בעבירה או מידע בדבר עבירה;
1,מאיים על אדם או מורה שיאיימו עליו בפגיעה בגופו או בנכסיו שלו או של אחר שהאדם יש לו ענין בו כדי לסחוט מן האדם הודיה בעבירה או מידע בדבר עבירה.
1,עובד הציבור שיש לו מכוח משרתו סמכות שיפוטית או מינהלית לגבי נכסים מסוג מסויים או לגבי עיסוק בחרושת במסחר או בעסק מסוג מסויים והוא משתמש בסמכותו לגביהם בין בעצמו ובין על ידי אחר כשיש לו במישרין או בעקיפין זיקה פרטית בהם דינו – מאסר שלוש שנים.
1,"עובד הציבור החייב או הרשאי להגיש דו""ח או הודעה בדבר סכום שהוא או אחר דורש או בענין אחר הטעון אישור לשם קבלת כסף או טובין והוא מגיש אותם בידיעה שהם כוזבים בפרט מהותי דינו – מאסר שלוש שנים."
1,תוך שימוש לרעה בסמכותו הוא עושה או מורה לעשות מעשה שרירותי הפוגע בזכותו של אחר;
1,נכנס למגוריו של אדם נגד רצונו כשאין הדבר מותר לו על פי דין או שלא לפי הסדרים שנקבעו לכך בדין.
1,מי שמוסמך או נדרש על פי דין ליתן תעודה העשויה להשפיע על זכויותיו של אדם והוא נותן אותה בידעו שהיא כוזבת בפרט מהותי דינו – מאסר חמש שנים.
1,מתיימר לפעול כבעל משרה שיפוטית והוא איננו בעל משרה כזאת;
1,מתיימר לפעול כמי שמוסמך על פי דין להשביע או לקבל תצהיר או לעשות כל פעולה אחרת בעלת אופי רשמי שרק מי שמוסמך לכך על פי דין רשאי לעשותה ואין לו הסמכה כאמור;
1,מתייצג כמי שמוסמך על פי דין לחתום על תעודה המעידה על תכנו של פנקס או רשומה המוחזקים בידי רשות חוקית או המעידה על עובדה או מאורע והוא חותם על אותה תעודה כמי שמוסמך לכך ובידעו שאיננו מוסמך לכך.
1,מתחזה כעובד הציבור כשאותו עובד נדרש מכוח תפקידו לעשות פעולה או להיות נוכח;
1,מתייצג בכזב כעובד הציבור ומתיימר מכוח תפקידו זה לעשות פעולה או להיות נוכח במקום לשם עשיית פעולה.
1,עובד הציבור העושה במילוי תפקידו מעשה מרמה או הפרת אמונים הפוגע בציבור אף אם לא היה במעשה משום עבירה אילו נעשה כנגד יחיד דינו – מאסר שלוש שנים.
1,עובד הציבור הנמנע במזיד למלא חובה המוטלת עליו על פי דין דינו – מאסר שלוש שנים זולת אם היה מילוי החובה כרוך בסכנה גדולה מזו שאדם בעל כוח ומרץ רגילים יכול לעמוד בה.
1,המפר הוראת חיקוק במזיד במעשה האסור לפי אותו חיקוק או בהימנעות ממעשה שעשייתו נדרשת לפי אותו חיקוק והדבר נוגע לציבור דינו – מאסר שנתיים; והוא אם אין נראית מאותו חיקוק כוונה לעונש אחר על הפרתו.
1,המפר הוראה שניתנה כשורה מאת בית משפט או מאת פקיד או אדם הפועל בתפקיד רשמי ומוסמך לאותו ענין דינו – מאסר שנתיים.
1,"המעליב בתנועות במלים או במעשים עובד הציבור או דיין או פקיד של בית דין דתי או חבר ועדת חקירה לפי חוק ועדות חקירה תשכ""ט–1968 כשהם ממלאים תפקידם או בנוגע למילוי תפקידם דינו – מאסר ששה חדשים."
1,המסית אדם או קבוצת בני אדם שלא לשלם או לעכב תשלום חובה שהודיעה עליו הממשלה ברשומות בין שההסתה היא מפורשת ובין שהיא משתמעת בין במלים שבעל פה או שבכתב ובין בסימנים או במוצגים חזותיים ובין בדרכים אחרות דינו – מאסר ששה חדשים; והוא הדין במי שעושה מעשה בכוונה להביא או ביודעין שהוא עלול להביא את אמצעי ההסתה האמורים במישרין או בעקיפין בכל צורה שהיא לידיעתם של אדם או של קבוצת בני אדם.
1,נותן שוחד לעובד הציבור כהגדרתו בסעיף 290(ב) בעד פעולה הקשורה בתפקידו דינו – מאסר שבע שנים או קנס כאמור בסעיף 290(א).
1,הנותן שוחד בכוונה להשפיע על קיומן מהלכן או תוצאותיהן של תחרות ספורט או תחרות אחרת שיש לציבור ענין בקיומן או בתוצאותיהן דינו – מאסר שלוש שנים.
1,לוקח השוחד דינו כדין נותן השוחד.
1,המקבל כסף שווה כסף שירות או טובת הנאה אחרת על מנת לתת שוחד – דינו כאילו היה לוקח שוחד; ואין נפקא מינה אם ניתנה בעד תיווכו תמורה לו או לאחר ואם לאו ואם התכוון לתת שוחד ואם לאו.
1,המביא אדם לידי התאבדות בשידול או בעצה או מסייע אדם להתאבד דינו – מאסר עשרים שנים.
1,אשה שגרמה במזיד במעשה או במחדל למות ולדה שלא מלאו לו שנים עשר חדשים ובשעת המעשה או המחדל היתה במצב של ערעור שיקול הדעת משום שעדיין לא החלימה לגמרי מתוצאות הלידה או משום תוצאות ההנקה לאחר הלידה הרי על אף היות העבירה לפי הנסיבות בגדר רצח או הריגה דינה – מאסר חמש שנים.
1,הגורם ברשלנות למותו של אדם דינו – מאסר שלוש שנים.
1,מנסה שלא כדין לגרום למותו של אדם;
1,עושה שלא כדין מעשה או נמנע שלא כדין מעשות מעשה שמחובתו לעשותו בכוונה לגרום למותו של אדם והמעשה או המחדל עלולים מטבעם לסכן חיי אדם.
1,המשתדל להעלים דבר לידתו של ולד בסלקו בחשאי את גוויית הולד בין שמת לפני הלידה או בשעת הלידה ובין לאחריה דינו – מאסר שנה.
1,מי שהפסיק ביודעין הריונה של אשה בין בטיפול רפואי ובין בדרך אחרת דינו – מאסר חמש שנים או קנס חמישים אלף לירות.
1,השולל מאדם או מנסה לשלול ממנו את כושר התנגדותו באמצעים שיש בהם סכנה לחיי אדם או לבריאותו או שיש בהם כדי לפגוע בפכחונו בכוונה לבצע פשע או עוון או להקל על ביצועם או להקל על בריחתו של עבריין לאחר ביצועם או לאחר נסיון לבצעם דינו – מאסר עשרים שנים.
1,פוצע אדם או גורם לו חבלה חמורה שלא כדין;
1,מנסה שלא כדין לפגוע באדם בקליע בסכין באבן או בנשק מסוכן או פוגעני אחר;
1,גורם שלא כדין להתפוצצותו של חומר נפיץ;
1,שולח או מוסר לאדם חומר נפיץ או כל דבר מסוכן או מזיק אחר או גורם לאדם שיקבל כל חומר או דבר כאמור;
1,מניח בכל מקום שהוא חומר מרסק או נפיץ או נוזל משתך;
1,זורק על אדם חומר או נוזל כאמור בפסקה (5) או משתמש בהם על גופו בדרך אחרת.
1,המניח בכל מקום שהוא חומר נפיץ שלא כדין בכוונה לגרום חבלה לזולתו דינו – מאסר ארבע עשרה שנים.
1,המונע או מפריע אדם שלא כדין במאמציו להציל את חייו או חיי אדם אחר כשהוא בכלי שיט הנתון במצוקה או בכלי שיט נטרף או כשהוא נמלט מכלי שיט כאמור דינו – מאסר עשר שנים.
1,מניח דבר על נתיב התחבורה או כלי התחבורה;
1,מטפל בנתיב תחבורה או כלי תחבורה או בכל דבר שעליהם או בקרבתם בדרך שיש בה כדי לפגוע בשימוש החפשי והבטוח של נתיב התחבורה או כלי התחבורה או בבטיחותו של נוסע כאמור או כדי לסכן את השימוש או הבטיחות האמורים;
1,מראה אור או אות על נתיב התחבורה או כלי התחבורה או בקרבתם או מטפל בכל דרך באור או באות הקיימים שם;
1,גורם לסיכון בטיחותו של נוסע כאמור בהימנעות מעשות מעשה שחובה עליו לעשותו.
1,החובל בחברו חבלה חמורה שלא כדין דינו – מאסר שבע שנים.
1,הפוצע חברו שלא כדין דינו – מאסר שלוש שנים.
1,הגורם שלא כדין שיפעילו על אדם או שאדם יקח רעל או דבר מזיק אחר בכוונה לפגוע בו או בזולתו או להרגיזם דינו – מאסר שלוש שנים; סיכן בכך את חיי האדם או גרם לו בכך חבלה חמורה דינו – מאסר ארבע עשרה שנים.
1,המפר ללא הצדק כדין את חובתו לספק לפלוני צרכי מחיה או לדאוג לבריאותו ולמנוע התעללות בו חבלה בגופו או פגיעה אחרת בשלומו ובבריאותו ומסכן או עלול לסכן בכך את חייו או פוגע או עלול לפגוע בכך בבריאותו פגיעת קבע דינו – מאסר שלוש שנים.
1,המחזיק משאיר או מפקיר כלי יריה חומר נפץ או חומר אחר שבכוחם לגרום נזק לאדם או לסכן חייו ללא נקיטת אמצעי זהירות סבירים למנוע אדם אחר מלגרום בהם נזק לעצמו או לאחר בין בטיפול כלשהו בהם ובין בלא טיפול דינו – מאסר שנה.
1,המשאיר או מפקיר דבר במקום שיש לילדים גישה אליו ויש יסוד סביר להניח שילדים ישחקו בדבר או יטפלו בו בדרך אחרת ושבעשותם כן הם עלולים להינזק בבריאותם או לסכן חייהם ואינו נוקט אמצעי זהירות סבירים כדי למנוע תוצאות כאלה דינו – מאסר שנה.
1,העושה מעשה שלא כדין או נמנע מעשות מעשה שחובתו לעשותו והמעשה או המחדל אינם מן המפורטים בסעיפים 338 עד 340 ונגרמה בהם חבלה לאדם דינו – מאסר שנה.
1,המעלה אור או מציג סימן או מצוף בכוונה להטעות אדם המפעיל כלי תחבורה או כשהוא יודע שהם עלולים להטעותו דינו – מאסר שבע שנים.
1,מי שביודעין או מתוך התרשלות מסיע אדם או גורם להסעתו בכלי תחבורה כשיש חשש לבטיחותו של הנוסע מחמת המצב או המטען של כלי התחבורה דינו – מאסר שלוש שנים ואם היה כלי התחבורה מטוס דינו – מאסר חמש שנים.
1,העושה מעשה או אינו נוקט זהירות סבירה בנכס שבהחזקתו או בפיקוחו וגורם בכך סכנה מכשול או נזק לאדם בדרך ציבורית או בנתיב שיט ציבורי דינו – מאסר שלוש שנים.
1,המחויב על פי דין או הסכם לדאוג לצורכי חייו של קטין או של מי שאינו מסוגל לדאוג לצורכי חייו הנתון להשגחתו למעט הורה אשר אינו מספק מזון לבוש צורכי לינה וצורכי חיים חיוניים אחרים במידה הדרושה לשמירת שלומו ובריאותו דינו – מאסר שלוש שנים זולת אם הוכיח שנקט אמצעים סבירים לפי הנסיבות להשגת הדרוש כדי לספק את הצרכים ואין בידו לספקם.
1,המציע או נותן תמורה בעד הרשות להחזיק בקטין שלא מלאו לו ארבע עשרה שנים והמבקש או מקבל תמורה בעד מתן רשות להחזיק בקטין כאמור דינו – מאסר שלוש שנים ואין נפקא מינה אם היתה התמורה בכסף או בשווה כסף.
1,הורה או אפוטרופוס של קטין שלא מלאו לו ארבע עשרה שנים המוסר או מרשה למסור את הקטין למי שאינו הורו או אפוטרופסו ויש במסירה משום התנערות מחובותיו או זכויותיו כלפי הקטין דינו – מאסר שנתיים.
1,המוציא או מעכב במרמה בכוח או בפיתויים קטין שלא מלאו לו ארבע עשרה שנים או מקבלו או מסתירו ביודעין שהוא הוצא או עוכב כאמור הכל בכוונה לשלול את החזקת הקטין מהורו מאפוטרופסו או ממי שחייב לפי הדין לטפל בו או להשגיח עליו ולקחתה לעצמו או לאחר דינו – מאסר שבע שנים והוא אם לא הוכיח שיש לו תביעה בתום לב לזכות ההחזקה כאמור.
1,"העורך טקס המרת דתו של קטין או עושה פעולה אחרת המביאה לידי המרת דתו של קטין בניגוד להוראות סעיף 13א לחוק הכשרות המשפטית והאפוטרופסות תשכ""ב–1962 דינו – מאסר ששה חדשים."
1,המשדל קטין בפניה ישירה אליו להמיר דתו דינו – מאסר ששה חדשים.
1,החוטף אדם בכוונה שייכלא שלא כחוק דינו – מאסר עשרים שנים.
1,החוטף אדם כדי לרצחו או כדי להעמידו בסכנת רצח או חוטף אדם כדי לסחוט או לאיים דינו – מאסר עשרים שנים.
1,החוטף אדם כדי שיהיה נתון לחבלה חמורה והחוטף אדם בידיעה שהנחטף יהיה נתון במצב כאמור דינם – מאסר עשרים שנים.
1,המסתיר או כולא אדם באיסור בידיעה שהוא נחטף דינו כאילו חטף את האדם באותה כוונה ידיעה או מטרה שהיו לו בהסתרת האדם או בכליאתו.
1,הכופה שלא כדין אדם לעבוד תוך שימוש בכוח או באמצעי לחץ אחר או תוך איום באחד מאלה או בהסכמה שהושגה בתרמית והכל בין בתמורה ובין שלא בתמורה – דינו מאסר שבע שנים.
1,העוצר או כולא אדם שלא כדין דינו – מאסר שלוש שנים; עצר אותו כשהוא מתחזה כבעל מעמד רשמי או מתיימר שיש לו צו דינו – מאסר חמש שנים.
1,התוקף שלא כדין את חברו דינו – מאסר שנתיים והוא אם לא נקבע בחוק זה עונש אחר לעבירה זו מחמת נסיבותיה.
1,התוקף חברו וגורם לו בכך חבלה של ממש דינו – מאסר שלוש שנים.
1,הגונב דינו – מאסר שלוש שנים והוא אם לא נקבע לגניבה עונש אחר מחמת נסיבותיה או מחמת טיבו של הדבר שנגנב.
1,עובד הציבור הגונב דבר שהוא נכס המדינה או דבר שהגיע לידיו מכוח עבודתו וערכו עולה על אלף שקלים חדשים דינו – מאסר עשר שנים.
1,עובד הגונב דבר שהוא נכס מעבידו או שהגיע לידי העובד בשביל מעבידו וערכו עולה על אלף שקלים חדשים דינו – מאסר שבע שנים.
1,חבר דירקטוריון או נושא משרה של תאגיד הגונב דבר שהוא נכס התאגיד דינו – מאסר שבע שנים.
1,גונב נכס שקיבל עם יפוי כוח לעשיה בו;
1,גונב נכס שהופקד אצלו לבדו או עם אדם אחר על מנת שישמרנו שמירה מעולה או ישתמש בו או בתמורתו כולם או מקצתם למטרה פלונית או ימסור כולם או מקצתם לאדם פלוני;
1,גונב נכס שקיבל לבדו או עם אדם אחר בשביל אדם אחר או לזכותו;
1,גונב מן התמורה של נייר ערך או של עשיה בנכס על פי יפוי כוח כשקיבל הוראה שתשמש למטרה פלונית או תשולם לאדם פלוני.
1,פנקס שיש על פי דין רשות או חובה לנהלו כדי לאמת או לרשום קנין בנכס או כדי לרשום לידות הטבלות נישואין פטירות או קבורות או העתק של חלק מפנקס כאמור שעל פי הדין יש לשלחו למשרד ציבורי – כל המסתירו או נוטלו ממקום הפקדתו בכוונה להונות דינו – מאסר חמש שנים.
1,המסתיר כתב צוואה בכוונה להונות בין שהמצווה חי ובין שהוא מת דינו – מאסר חמש שנים.
1,המסתיר בכוונה להונות מסמך או חלק ממנו שהם ראיה לקנין או לזכות קנין במקרקעין דינו – מאסר שלוש שנים.
1,ההורג חיה הניתנת להיגנב בכוונה לגנוב את העור או את הגופה או חלק מהם דינו כאילו גנב את החיה.
1,המנתק כליל דבר שהיה מחובר למקרקעין בכוונה לגנבו דינו כאילו גנב את הדבר אחרי שנותק.
1,הנוטל או מסתיר עפרות מתכת או מחצב במכרה או בסביבתו או עושה שם מעשה אחר בהם בכוונה להונות אדם דינו – מאסר שלוש שנים.
1,מי שבמזיד או במרמה נוטל או צורך חשמל או מים או גז שאינו זכאי להם או משתמש בהם או גורם להטייתם או לבזבוזם דינו – מאסר שלוש שנים.
1,הגונב דבר ובשעת מעשה או בתכוף לפניו או לאחריו מבצע או מאיים לבצע מעשה אלימות באדם או בנכס כדי להשיג את הדבר הנגנב או לעכבו אצלו או כדי למנוע התנגדות לגניבת הדבר או להתגבר עליה הרי זה שוד ודינו של השודד – מאסר ארבע עשרה שנים.
1,היה השודד מזויין בנשק או במכשיר שיש בהם כדי לסכן או לפגוע או שהיה בחבורה או שבשעת השוד או בתכוף לפניו או לאחריו הוא פצע אדם הכהו או השתמש באלימות אחרת כלפי גופו דינו – מאסר עשרים שנים.
1,התוקף אדם לשם שוד דינו – מאסר שבע שנים; ואם נעברה העבירה בנסיבות כאמור בסעיף 402(ב) דינו – מאסר עשרים שנים.
1,הדורש מאדם דבר ערך בכוונה לגנבו תוך שימוש באיומים או בכוח דינו – מאסר חמש שנים; נעברה העבירה כשהעבריין נושא נשק חם או קר דינו – מאסר עשר שנים.
1,הנכנס למקום המשמש למגורי אדם או לתפילה או הנמצא בהם בכוונה לבצע גניבה או פשע דינו – מאסר חמש שנים.
1,המתפרץ למקום כאמור בסעיף קטן (א) בכוונה לבצע גניבה או פשע או המתפרץ מתוכו לאחר שביצע בו גניבה או פשע או נכנס אליו לשם כך דינו – מאסר שבע שנים.
1,המתפרץ לבנין שאינו משמש בית מגורים ולא מקום תפילה או לבנין שהוא אמנם סמוך לבית מגורים ומוחזק יחד עמו אך איננו חלק ממנו בכוונה לבצע בהם גניבה או פשע דינו – מאסר חמש שנים.
1,המתפרץ לבנין כאמור בסעיף קטן (א) ומבצע בו גניבה או פשע או מתפרץ מתוכו לאחר שביצע בו גניבה או פשע דינו – מאסר שבע שנים.
1,נעברה עבירה לפי סעיפים 406או 407 כשהעבריין נושא נשק חם או קר דינו – כפל העונש הקבוע לעבירה.
1,מי שנמצא ברשותו מכשיר המשמש לשם פריצה לבנין ואין לו הסבר סביר לכך דינו – מאסר שלוש שנים.
1,הוא מזויין בנשק או במכשיר שיש בהם לסכן או לפגוע בכוונה לפרוץ או להיכנס לבנין ולבצע בו גניבה או פשע;
1,הוא מחזיק מכשיר המשמש לשם פריצה לבנין בכוונה לבצע פשע;
1,פניו רעולים או מושחרים או הוא מוסווה בדרך אחרת בכוונה לבצע גניבה או פשע;
1,הוא נמצא בבנין בכוונה לבצע בו גניבה או פשע ונקט אמצעים להסתיר את נוכחותו.
1,המקבל במזיד בעצמו או על ידי שלוח דבר כסף נייר ערך או כל נכס אחר כשהוא יודע כי בפשע נגנב נסחט הושג או נעשה בו והנוטל עליו בעצמו או על ידי שלוח לבדו או ביחד עם אחר את השליטה או העשיה בנכס כאמור דינם – מאסר שבע שנים אולם יכולים הם להיות נידונים בבית משפט המוסמך לשפוט את מבצע הפשע ויהיו צפויים לעונש שהוא צפוי לו.
1,המקבל בעצמו או על ידי שלוח דבר כסף נייר ערך או כל נכס אחר כשהוא יודע כי בעוון נלקח הושג נשלחה בו יד או נעשה בו והנוטל עליו בעצמו או על ידי שלוח לבדו או ביחד עם אחר את השליטה או העשיה בנכס כאמור דינם כדין מבצע אותו עוון.
1,המחזיק דבר כסף נייר ערך או כל נכס אחר שיש עליהם חשד סביר שהם גנובים ואין בידו להניח את דעתו של בית משפט שרכש את ההחזקה בהם כדין דינו – מאסר ששה חדשים.
1,המקבל דבר במרמה דינו – מאסר שלוש שנים ואם נעברה העבירה בנסיבות מחמירות דינו – מאסר חמש שנים.
1,המקבל דבר בתחבולה או בניצול מכוון של טעות הזולת שאין בהם מרמה דינו – מאסר שנתיים.
1,המתחזה לעשות מעשה כישוף בכוונה לקבל דבר דינו – מאסר שנתיים; קיבל דבר בעד מעשה הכישוף או על פיו דינו – מאסר שלוש שנים; לענין סעיף זה ”כישוף“ – לרבות מעשה קוסם והגדת עתידות.
1,המזייף מסמך שיש בו ידיעה על אדם או על תאגיד בכוונה לרמות דינו – מאסר שלוש שנים; אין נפקא מינה לענין זה אם האדם או התאגיד היו קיימים או לא ואם התאגיד עמד להיווסד אך לא נוסד.
